<?xml version="1.0" encoding="UTF-8"?>
<tns:getWorkflowsResponse xmlns:tns="http://pad.polito.it/WorkflowRestricted" xmlns:xsi="http://www.w3.org/2001/XMLSchema-instance" xsi:schemaLocation="http://pad.polito.it/WorkflowRestricted WorkflowRestrictedService_schema.xsd ">
	<workflow>
		<name>Name</name>
		<PCode>PCode</PCode>
		<PCode>PCode1</PCode>
	</workflow>
	<workflow>
		<name>Name1</name>
		<action>
			<name>Name</name>
			<automaticallyInstantiated>true</automaticallyInstantiated>
			<role>role</role>
		</action>
		<action>
			<name>Name1</name>
			<automaticallyInstantiated>true</automaticallyInstantiated>
			<role>role</role>
		</action>
		<tns:processSummary>
			<PCode>PCode</PCode>
			<workflowName>Name1</workflowName>
			<actionStatus>
				<ACode>ACode</ACode>
				<name>Name1</name>
			</actionStatus>
			<availableActionStatus>
				<ACode>ACode</ACode>
				<name>Name</name>
			</availableActionStatus>
			<activeActionStatus>
				<ACode>ACode2</ACode>
				<name>Name</name>
			</activeActionStatus>
			<terminatedActions>0</terminatedActions>
		</tns:processSummary>
		<tns:processSummary>
			<PCode>PCode2</PCode>
		</tns:processSummary>
	</workflow></tns:getWorkflowsResponse>
